{
  "schema_version": "1.0.0",
  "artifact_version": "1.0.0",
  "status": "ACTIVE_INFORMATIVE",
  "normative_baseline": "4.3.0",
  "claim_boundary": "Post-rc.1 finite symbolic grounding/oversight checks only; no real notification, truth-oracle or runtime-conformance claim.",
  "predicates": [
    {
      "id": "EGO-P01",
      "name": "grounded_reason_classes",
      "existing_requirement_ids": [
        "MVP-005",
        "MVP-006",
        "KAI-REQ-003"
      ]
    },
    {
      "id": "EGO-P02",
      "name": "enforce_objection_at_effect_boundary",
      "existing_requirement_ids": [
        "MVP-004",
        "MVP-006",
        "ECI-REQ-002"
      ]
    },
    {
      "id": "EGO-P03",
      "name": "mandatory_escalation_survives_team_pressure",
      "existing_requirement_ids": [
        "MVP-007",
        "DAI-REQ-002"
      ]
    },
    {
      "id": "EGO-P04",
      "name": "distinguish_delivery_stages",
      "existing_requirement_ids": [
        "MVP-007",
        "EAA-REQ-002"
      ]
    },
    {
      "id": "EGO-P05",
      "name": "authorized_minimal_oversight_channel",
      "existing_requirement_ids": [
        "MVP-003",
        "DAI-REQ-002"
      ]
    },
    {
      "id": "EGO-P06",
      "name": "preserve_owner_and_custody",
      "existing_requirement_ids": [
        "DAI-REQ-002",
        "MVP-007"
      ]
    },
    {
      "id": "EGO-P07",
      "name": "bound_delay_and_completion_claims",
      "existing_requirement_ids": [
        "MVP-006",
        "EAA-REQ-002"
      ]
    },
    {
      "id": "EGO-P08",
      "name": "independent_review_before_resolution",
      "existing_requirement_ids": [
        "ICA-REQ-003",
        "EAA-REQ-002"
      ]
    }
  ],
  "cases": [
    {
      "id": "EGO-T01",
      "quint_test": "egoPermittedWorkTest",
      "predicate_ids": [
        "EGO-P01",
        "EGO-P02",
        "EGO-P07"
      ],
      "steps": [
        {
          "event": "ground",
          "facts": {
            "scopeAuthorized": true,
            "observationsCurrent": true,
            "evidenceComplete": true,
            "ruleKnown": true,
            "factsSupport": true,
            "policyPermits": true
          }
        },
        {
          "event": "robot"
        },
        {
          "event": "intervention"
        }
      ],
      "expected": {
        "reason": "permitted",
        "robotExecuted": true,
        "interventionOutcome": "allow",
        "required": false
      }
    },
    {
      "id": "EGO-T02",
      "quint_test": "egoContradictedPremiseTest",
      "predicate_ids": [
        "EGO-P01",
        "EGO-P02"
      ],
      "steps": [
        {
          "event": "ground",
          "facts": {
            "scopeAuthorized": true,
            "observationsCurrent": true,
            "evidenceComplete": true,
            "ruleKnown": true,
            "factsSupport": false,
            "policyPermits": true
          }
        },
        {
          "event": "robot"
        },
        {
          "event": "intervention"
        },
        {
          "event": "child"
        }
      ],
      "expected": {
        "reason": "contradicted",
        "robotExecuted": false,
        "interventionOutcome": "review",
        "deploymentOutcome": "block"
      }
    },
    {
      "id": "EGO-T03",
      "quint_test": "egoUnknownIsNotContradictedTest",
      "predicate_ids": [
        "EGO-P01",
        "EGO-P02"
      ],
      "steps": [
        {
          "event": "ground",
          "facts": {
            "scopeAuthorized": true,
            "observationsCurrent": true,
            "evidenceComplete": false,
            "ruleKnown": true,
            "factsSupport": true,
            "policyPermits": true
          }
        },
        {
          "event": "robot"
        }
      ],
      "expected": {
        "reason": "insufficient_evidence",
        "robotExecuted": false
      }
    },
    {
      "id": "EGO-T04",
      "quint_test": "egoStaleObservationTest",
      "predicate_ids": [
        "EGO-P01",
        "EGO-P02"
      ],
      "steps": [
        {
          "event": "ground",
          "facts": {
            "scopeAuthorized": true,
            "observationsCurrent": false,
            "evidenceComplete": true,
            "ruleKnown": true,
            "factsSupport": true,
            "policyPermits": true
          }
        },
        {
          "event": "robot"
        }
      ],
      "expected": {
        "reason": "insufficient_evidence",
        "robotExecuted": false
      }
    },
    {
      "id": "EGO-T05",
      "quint_test": "egoUnknownPolicyTest",
      "predicate_ids": [
        "EGO-P01"
      ],
      "steps": [
        {
          "event": "ground",
          "facts": {
            "scopeAuthorized": true,
            "observationsCurrent": true,
            "evidenceComplete": true,
            "ruleKnown": false,
            "factsSupport": true,
            "policyPermits": true
          }
        }
      ],
      "expected": {
        "reason": "insufficient_evidence"
      }
    },
    {
      "id": "EGO-T06",
      "quint_test": "egoProhibitedMeansTest",
      "predicate_ids": [
        "EGO-P01",
        "EGO-P02"
      ],
      "steps": [
        {
          "event": "ground",
          "facts": {
            "scopeAuthorized": true,
            "observationsCurrent": true,
            "evidenceComplete": true,
            "ruleKnown": true,
            "factsSupport": true,
            "policyPermits": false
          }
        },
        {
          "event": "robot"
        }
      ],
      "expected": {
        "reason": "prohibited",
        "robotExecuted": false
      }
    },
    {
      "id": "EGO-T07",
      "quint_test": "egoMissingGrantTest",
      "predicate_ids": [
        "EGO-P01",
        "EGO-P02"
      ],
      "steps": [
        {
          "event": "ground",
          "facts": {
            "scopeAuthorized": false,
            "observationsCurrent": true,
            "evidenceComplete": true,
            "ruleKnown": true,
            "factsSupport": true,
            "policyPermits": true
          }
        },
        {
          "event": "child"
        }
      ],
      "expected": {
        "reason": "unauthorized",
        "deploymentOutcome": "block"
      }
    },
    {
      "id": "EGO-T08",
      "quint_test": "egoRevocationIsNotSunkCostTest",
      "predicate_ids": [
        "EGO-P01",
        "EGO-P02"
      ],
      "steps": [
        {
          "event": "revoke"
        },
        {
          "event": "ground",
          "facts": {
            "scopeAuthorized": true,
            "observationsCurrent": true,
            "evidenceComplete": true,
            "ruleKnown": true,
            "factsSupport": true,
            "policyPermits": true
          }
        },
        {
          "event": "robot"
        }
      ],
      "expected": {
        "reason": "unauthorized",
        "robotExecuted": false
      }
    },
    {
      "id": "EGO-T09",
      "quint_test": "egoCorrectionRestoresUsefulWorkTest",
      "predicate_ids": [
        "EGO-P01",
        "EGO-P02"
      ],
      "steps": [
        {
          "event": "ground",
          "facts": {
            "scopeAuthorized": true,
            "observationsCurrent": true,
            "evidenceComplete": true,
            "ruleKnown": true,
            "factsSupport": false,
            "policyPermits": true
          }
        },
        {
          "event": "ground",
          "facts": {
            "scopeAuthorized": true,
            "observationsCurrent": true,
            "evidenceComplete": true,
            "ruleKnown": true,
            "factsSupport": true,
            "policyPermits": true
          }
        },
        {
          "event": "robot"
        },
        {
          "event": "intervention"
        }
      ],
      "expected": {
        "reason": "permitted",
        "robotExecuted": true,
        "interventionOutcome": "allow"
      }
    },
    {
      "id": "EGO-T10",
      "quint_test": "egoNonReportableRoutineEventTest",
      "predicate_ids": [
        "EGO-P03",
        "EGO-P07"
      ],
      "steps": [
        {
          "event": "incident",
          "required": false,
          "hold": false
        },
        {
          "event": "robot"
        },
        {
          "event": "intervention"
        }
      ],
      "expected": {
        "required": false,
        "stage": 0,
        "robotExecuted": true,
        "interventionOutcome": "allow"
      }
    },
    {
      "id": "EGO-T11",
      "quint_test": "egoMandatoryIncidentHoldsEffectsTest",
      "predicate_ids": [
        "EGO-P02",
        "EGO-P03",
        "EGO-P07"
      ],
      "steps": [
        {
          "event": "incident",
          "required": true,
          "hold": true
        },
        {
          "event": "robot"
        },
        {
          "event": "intervention"
        },
        {
          "event": "child"
        }
      ],
      "expected": {
        "required": true,
        "stage": 1,
        "robotExecuted": false,
        "interventionOutcome": "review",
        "deploymentOutcome": "block"
      }
    },
    {
      "id": "EGO-T12",
      "quint_test": "egoNoAutomaticGlobalStopTest",
      "predicate_ids": [
        "EGO-P02",
        "EGO-P07"
      ],
      "steps": [
        {
          "event": "incident",
          "required": true,
          "hold": false
        },
        {
          "event": "robot"
        }
      ],
      "expected": {
        "required": true,
        "stage": 1,
        "robotExecuted": true
      }
    },
    {
      "id": "EGO-T13",
      "quint_test": "egoDeadlineStopsAffectedWorkTest",
      "predicate_ids": [
        "EGO-P02",
        "EGO-P07"
      ],
      "steps": [
        {
          "event": "incident",
          "required": true,
          "hold": false
        },
        {
          "event": "tick"
        },
        {
          "event": "tick"